,media,title,content,writer,datetime,id,url,source,keyword
161,경향신문,강원·경기·인천 DMZ·서해 접경지역 네트워크 출범,"경기·인천·강원 지방의제21은 정전협정 60주년을 맞아 17일 ‘강원·경기·인천 DMZ·서해 접경지역 네트워크’가 출범한다고 16일 밝혔다.이들은 강원·경기·인천 네트워크는 정전 60년만에 처음으로 조직된 DMZ와 한강하구 및 서해 5도가 속한 지역간 민간중심 네트워크라고 밝혔다.이들은 출범식에서 DMZ·서해 접경지역의 평화와 지속가능한 발전을 위해 서식지 보전·지역자원 발굴·지속가능 경제·평화생태 관광·대중인식 증진·민·관 협력·남북 및 국제협력 등 7대 의제 및 19개 행동강령을 발표하고 지역사회의 참여를 통해 실천해 나갈 것을 선언했다.지역별 실천과제로는 평화 깃대종(두루미, 저어새, 점박이물범 등)을 보호하고, 남북한 공동조사·연구를 제안하는 것을 담고 있다.또 군부대와 협력한 환경위해식물 제거, 평하생태관광프로그램 개발과 마을주민 중심의 가이드 양성, 로컬푸드 확산, 서해도서 배삯 지원 등의 사업도 검토하고 있다.이밖에 시민평화교육, 민·관·군 DMZ주민대학 실시, 지역 및 국제협력 네트워크 구성, DMZ평화생명축제 공동 개최 등도 검토하고 있다.네트워크는 제15회 지속가능발전전국대회(9월4~6일·수원시)에서 7대 의제에 따른 공동의 행동강령과 지역별 실천과제가 담긴 ‘평화와 지속가능발전을 위한 DMZ·서해 접경지역 의제’를 작성, 선포할 예정이라고 밝혔다.푸른경기21 실천협의회 관계자는 “강원·경기·인천 네트워크는 정전60주년 행사에서 비춰지는 일회성, 전시성 행사의 한계를 극복하고 주민 참여적인 상향식 민관협력 활동이 활성화되는 계기를 만들어 나갈 것”이라고 밝혔다.<경태영 기자 kyeong@kyunghyang.com>경향신문 [오늘의 인기뉴스]▶ [속보]‘금속탐지기’까지 들고 간 檢, 전두환 집에서…▶ [단독]“노조원 패도 돼요?” 만도 사장 “개값? 물어주지”▶ [단독]새누리 의원, 경찰 고위간부 술자리 폭행…왜?▶ [화제]해변에 ‘용의 머리뼈’가…시민들 깜짝▶ 푸이그 바른생활맨 만든 ‘사감선생’모바일 경향 [경향 뉴스진 | 경향신문 앱 | 모바일웹] | 공식 SNS 계정 [경향 트위터] [미투데이] [페이스북] [세상과 경향의 소통 Khross]- ⓒ 경향신문(www.khan.co.kr), 무단전재 및 재배포 금지〈경향신문은 한국온라인신문협회(www.kona.or.kr)의 디지털뉴스이용규칙에 따른 저작권을 행사합니다.〉 ",,2013.07.16. 오후 6:36,04b7e1b9961cd3c0a5b5bf7cdbe8e2c5,https://news.naver.com/main/read.nhn?mode=LSD&mid=sec&sid1=102&oid=032&aid=0002360340,NAVER_NEWS,"""깃대종"""
162,뉴스1,DMZ·서해 접경지역 네트워크 출범,"강원·경기·인천 DMZ·서해 접경지역 네트워크 제공. News1""지속가능한 발전""…7대 의제 발표(서울=뉴스1) 박응진 기자 = 강원·경기·인천 지방의제21은 오는 27일 정전협정 60주년을 맞아 17일 오전 10시30분 서울 중구 프레스센터에서 '강원·경기·인천 DMZ·서해 접경지역 네트워크'(이하 네트워크)를 출범했다.이날 네트워크는 출범 선언문을 통해 ""DMZ와 한강하구 및 서해 5도 접경지역의 지속가능한 발전을 위해 평화·생명 운동의 경험을 바탕으로 한 걸음씩 나아가겠다""고 밝혔다.이를 위해 네트워크는 ▲서식지 보전 ▲지역자원 발굴 ▲지속가능경제 모색 ▲평화생태관광 조성 ▲대중인식 증진 ▲민관 협력 ▲남북 및 국제협력 등 7대 의제를 발표했다.또 지역별 실천 과제로 군부대 협력을 통한 환경위해식물 제거, 생태체험마을 조성, 깃대종(저어새·점박이물범· 꽃게 등) 보호를 위한 남북공동 조사를 추진할 계획이다.네트워크를 조직한 지방의제21은 지난 1992년 브라질 리우에서 열린 세계환경정상회담에서 인류의 지속가능한 발전을 위해 세계 각 도시별로 조직된 협의체이다.pej86@박응진[관련기사]32억원 당첨된 소녀 ""현재는 340만원 뿐""진에어, 5년만에 유니폼 갈아입는다'배수지 수몰' 유족 ""위험해 가기 싫다 했는데…""노량진 수몰사고…박원순 취임 후 최대시련저작권자 뉴스1코리아, 무단전재 및 재배포 금지 ",,2013.07.17. 오후 3:41,b133af209bf7ef107c334e6e6d73e160,https://news.naver.com/main/read.nhn?mode=LSD&mid=sec&sid1=101&oid=421&aid=0000381954,NAVER_NEWS,"""깃대종"""
163,연합뉴스,DMZ 상징하는 깃대종에 '두루미' 선정,"(서울=연합뉴스) 이슬기 기자 = 환경부는 비무장지대(DMZ) 형성 60주년을 맞아 전 세계적 멸종위기종인 '두루미'를 DMZ 일원의 깃대종으로 선정했다고 18일 밝혔다.깃대종은 지역별 생태·지리·문화적 특성을 반영하는 상징적인 야생동식물로, 사람들이 중요하다고 인식하는 종이다.환경부는 먼저 누리꾼 투표와 전문가 심의를 거쳐 DMZ 일원의 대표적 생물 12종을 정했다. 반달가슴곰, 하늘다람쥐, 수달, 점박이 물범, 사향노루, 두루미, 독수리, 산양, 재두루미, 닻꽃, 날개하늘나리, 금개구리 등이 뽑혔다.이 가운데 두루미는 DMZ 일원을 주요 서식지로 하는 가장 대표적인 멸종위기종이라는 점에서 깃대종으로 최종 선정됐다고 환경부는 설명했다.환경부가 2008년부터 진행한 조사결과 DMZ 일원에는 약 106종의 멸종위기종을 포함해 5천97종의 생물종이 서식하는 것으로 확인됐다.환경부는 오는 19일 오전 10시 일산 킨텍스에서 열리는 'DMZ 60주년 생태환경대회'에서 이런 내용을 발표할 계획이다.'미래 세대에 인류 공동의 자산을'이라는 슬로건으로 진행되는 행사에는 박경서 초대 인권대사와 국내외 전문가들이 참가한다. 이날 개회식을 포함해 DMZ 보전과 지속 가능한 이용방안을 마련하기 위한 국제심포지엄 등이 열린다.독일연방자연보전청 우베리켄 박사는 통일 후 독일이 동·서독 국경지역 1천390㎞를 녹색띠(그뤼네스 반트)로 성공적으로 보전해 관리하고 있는 사례를 소개할 예정이다.wise@yna.co.kr[이 시각 많이 본 기사]☞ 국세청·檢, 전두환 일가 보험계약 전방위 조사☞ <요즘 드라마 주인공 '특별한 능력자'가 대세>☞ 국가기록원서 '대화록' 못찾아…유실 가능성 파장(종합2보)☞ 골프계 슬픔 속에 故구옥희 영결식(종합)☞ 北, 파나마에 '억류 선박' 즉시 출항조치 요구▶ 연합뉴스 모바일앱 다운받기  ▶ 인터랙티브뉴스<저작권자(c)연합뉴스. 무단전재-재배포금지.> ",,2013.07.18. 오후 12:00,d3626359f8369a03c623d9d65aabaa3f,https://news.naver.com/main/read.nhn?mode=LSD&mid=sec&sid1=102&oid=001&aid=0006379578,NAVER_NEWS,"""깃대종"""
164,연합뉴스,DMZ 60주년 생태환경대회…'두루미' 깃대종 선정,"'DMZ 천연 생태 보존합시다' (고양=연합뉴스) 임병식 기자 = 19일 경기도 고양시 킨텍스에서 열린 DMZ 60주년 생태 환경대회에서 참석 내빈들이 국기에 대한 경례를 하고 있다. 왼쪽에서부터 심상정 진보정의당 의원, 한기호 새누리당 의원, 윤성규 환경부 장관, 한명숙 민주당 의원. 2013.7.19 andphotodo@yna.co.kr환경부 킨텍스서 DMZ 대표 생물 12종 발표, 오후엔 국제심포지엄(고양=연합뉴스) 우영식 기자 = 1953년 7월 27일 정전협정으로 만들어져 60년 된 비무장지대(DMZ)의 생태 가치를 알리고 자연유산으로 보전하기 위한 'DMZ 60주년 생태환경대회'가 19일 경기도 고양시 킨텍스에서 열렸다.행사를 주최한 환경부는 이날 오전 생태환경대회 개회식에서 DMZ를 대표하는 생물 12종을 발표하고 세계적 멸종위기종인 '두루미'를 DMZ 깃대종으로 선정했다.깃대종은 지역별 생태·지리·문화적 특성을 반영하는 상징적인 야생동식물로 사람들이 중요하다고 인식하는 종이다.개회사하는 윤성규 장관 (고양=연합뉴스) 임병식 기자 = 윤성규 환경부 장관이 19일 경기도 고양시 킨텍스에서 열린 DMZ 60주년 생태 환경대회에서 개회사를 하고 있다. 2013.7.19 andphotodo@yna.co.krDMZ 대표 생물 12종은 반달가슴곰, 하늘다람쥐, 수달, 점박이 물범, 사향노루, 두루미, 독수리, 산양, 재두루미, 금개구리, 닻꽃, 날개하늘나리 등이다.환경부는 발표에 앞서 누리꾼 심사와 전문가 심의를 거쳐 DMZ 대표 생물과 깃대종을 선정했다.환경부는 2008년부터 진행한 DMZ 일원 생태계 조사결과 106종의 멸종위기종을 포함, 5천97종의 생물종이 서식하는 것으로 확인됐다고 밝혔다.개회식에서는 자연환경국민신탁이 주관하고 환경부가 후원하는 'DMZ 땅 한 평 저축하기'에 박경서 초대 인권대사 등 사회 저명인사들이 기금을 기부하는 약정식도 진행됐다.자연환경국민신탁은 '문화유산과 자연환경자산에 관한 국민신탁법'에 의해 설립된 자연환경자산의 취득 및 관리를 목적으로 하는 법인이다.'DMZ 천연 생태 보존합시다' (고양=연합뉴스) 임병식 기자 = 19일 경기도 고양시 킨텍스에서 열린 DMZ 60주년 생태 환경대회에서 참석 내빈들이 DMZ 땅 한평 저축 약정 및 기부 퍼포먼스를 하고 있다. 2013.7.19 andphotodo@yna.co.kr자연환경국민신탁은 저명인사들이 기부한 기금을 DMZ 생태계 보전에 사용할 방침이다.오후에는 '미래 세대에 인류 공동의 자산을'이라는 슬로건 아래 DMZ 보전과 지속 가능한 이용방안을 마련하기 위한 국제심포지엄이 마련됐다.심포지엄에서는 서울대 김귀곤 교수가 'DMZ 가치의 재조명'이란 주제로 기조연설을 하는 데 이어 독일연방자연보전청 우베리켄 박사가 통일 후 독일이 동·서독 국경지역 1천390㎞를 녹색띠(그뤼네스 반트)로 만들어 성공적으로 보전, 관리하는 사례를 소개한다.또 'DMZ 가치와 효율적 보전', 'DMZ 일원의 지속가능한 발전과 글로벌트러스트' 2개 세션으로 나뉘어 전문가 토론이 진행된다.wyshik@yna.co.kr[이 시각 많이 본 기사]☞ ""구명조끼 아무도 안입었다…학생 90명에 교관 2명뿐""☞ '너목들' 이다희 ""극중 멜로 없어도 아쉽지 않아""☞ 태안 사설 해병캠프 실종자 시신 2구 인양(종합)☞ <美야구> 추신수·류현진, 전반기 활약에 연이은 호평☞ <기자수첩> 어린 목숨보다 이미지 훼손 걱정이 우선인 어른들▶ 연합뉴스 모바일앱 다운받기  ▶ 인터랙티브뉴스<저작권자(c)연합뉴스. 무단전재-재배포금지.> ",,2013.07.19. 오전 11:00,9cfac197491b90f001ccc2d083658bab,https://news.naver.com/main/read.nhn?mode=LSD&mid=sec&sid1=100&oid=001&aid=0006381848,NAVER_NEWS,"""깃대종"""
165,SBS(text),"경기도, 수해취약지역 점검…늑장행정 논란","<앵커> 수해취약지역에 대해서 경기도가 어제 현장점검을 벌였습니다. 늑장행정이 문제로 지적됐습니다. 의정부지국 송호금 기자가 보도합니다. <기자> 네, 지난 2011년 산사태나 하천이 범람해서 수해를 입은 광주와 포천, 동두천시에서 점검이 벌어졌습니다.수해방지시설, 만들고는 있는데 공사가 너무 늦습니다. 화면 보시죠. 2년 전 400mm가 넘는 집중 호우로 범람위기를 맞았던 동두천 신천.수해예방을 위해서 빗물펌프장 15개를 짓고 있는데 그중 10개가 아직 터파기 단계, 아니면 시작도 못했습니다. [김문수/경기도 지사 : 수해피해가 오기 전에 공사를 완료해야 하는 것이 아닐까 합니다. 늦어도 6월 말까지는 공사를 끝내야지… ][오세창/동두천시장 : 행정절차가 정말 시간이 많이 걸려요. 공고기간, 심의기간 이렇게…단축이 돼야죠.]두 차례 피해를 입은 포천의 영평천도 마찬가지입니다. [이용휘/포천시 재난관리과장 : 2시간 연속 강우, 약 94mm가 왔는데 넘지는 않았지만 재방에 물이 차서 난간까지 물이 치는 그런 피해가 있었습니다.]  성동1교, 와룡교, 장임교등 다리 3곳을 새로 놓거나 개선하기로 했는데, 공사가 늦어졌습니다. 다만 이번 집중호우에서 산사태 피해는 크게 줄었습니다. 사방댐 5백여 개를 조기설치한 덕분이라는 평가를 받았습니다. [김문수/경기도 지사 : 하폭을 넓히고 다리를 더 높이 들어올려서 물이 잘 빠져나가면서도 하천이 넘지 않도록 시설개량을 계속 해나가도록하겠습니다.]경기도는 지난 2011년 수해이후 지금까지 1조 6천억원을 들여서 수해복구와 하천정비사업을 추진해 왔다고 밝혔습니다. --- 종전 60년을 맞은 비무장지대 DMZ의 생태를 보전하기 위한 'DMZ생태환경대회'가 고양 킨텍스에서 열렸습니다.대회에서는 DMZ의 생태적인 상징성을 나타내는 깃대종으로 두루미를 선정하고 수달, 하늘다람쥐 등 12종을 DMZ 대표 생물로 지정했습니다.  송호금 기자pcvirus@sbs.co.kr관/련/정/보◆ '모래시계' 김종학, 고시텔서 숨진 채 발견◆ 뉴욕서 보잉 737기 동체착륙…승객 다쳐◆ [속보] 류현진 시즌 8승…다저스 14점 타선 폭발!◆ 청정 독도? 바닷속에 거대한 쓰레기 산이…◆ ""사람들에게…"" 한혜진 고민에 법륜스님 대답은☞ [SBS기자들의 생생한 취재현장 뒷이야기 '취재파일']☞ SBS뉴스 공식 SNS [SBS8News 트위터] [페이스북] [미투데이] [요즘]저작권자 SBS&SBS콘텐츠허브 무단복제-재배포 금지 ",,2013.07.23. 오후 1:09,51e367f3fb107c7301623166c2e1bdca,https://news.naver.com/main/read.nhn?mode=LSD&mid=sec&sid1=102&oid=096&aid=0000251695,NAVER_NEWS,"""깃대종"""
166,뉴스1,치악산서 한국특산식물 금강초롱꽃 만개,"16일 만개한 금강초롱꽃.(사진제공=치악산사무소)2013.8.16/뉴스1 News1(강원=뉴스1) 권혜민 기자 = 국립공원관리공단 치악산사무소(소장 신종두)는 지구온난화와 남획으로 사라져가는 한국특산식물인 금강초롱꽃이 치악산 멸종위기식물원에서 만개 했다고 15일 밝혔다.금강초롱꽃은 치악산 깃대종(특정지역의 생태지리문화적 특성을 반영하는 상징적인 야생 동식물)으로 공원사무소에서 서식지 보호를 위해 일부구간에 펜스를 설치했으며, 채종과 발아를 통해 증식을 진행 중이다.현재 치악산 멸종위기식물원 내 희귀식물들은 사무소와 한국자생식물보존회(회장 조병필)에서 공동관리하고 있다.금강초롱꽃은 우리나라 중부 및 북부 이북의 고산지대 깊은 숲에서 자라는 다년생 초생이다. 꽃은 8월~9월 피고 연한 자주색을 띄며 종(鐘) 모양이다.hoyanarang@권혜민[관련기사]'아빠 어디가' 법적대응 ""악성댓글 더는 못봐""쿠키런 업데이트…숨겨진 비밀코드는?남북 오후 5시 25분 3차 수석대표접촉(속보)STX팬오션 등 회생안 확정시 재감사 가능저작권자 뉴스1코리아, 무단전재 및 재배포 금지 ",,2013.08.15. 오전 9:33,c3fdf00bd408961ebdc848a2e6477669,https://news.naver.com/main/read.nhn?mode=LSD&mid=sec&sid1=102&oid=421&aid=0000421212,NAVER_NEWS,"""깃대종"""
167,뉴스1,'금강초롱꽃' 치악산 식물원에 만개,"만개한 금강초롱꽃(사진제공=치악산국립공원사무소).2013.8.16 News1사라져가는 깃대종 중 하나(강원=뉴스1) 권혜민 기자 = 국립공원관리공단 치악산사무소(소장 신종두)는 지구온난화와 남획으로 사라져가는 한국특산식물인 금강초롱꽃이 치악산 멸종위기식물원에 만개했다고 16일 밝혔다.금강초롱꽃은 치악산의 깃대종으로, 공원사무소는 주요 서식지를 보호하기 위해 일부구간에 펜스를 설치하고 채종과 발아를 통한 증식사업에 힘쓰고 있다.만개한 금강초롱꽃(사진제공=치악산국립공원사무소).2013.8.16 News1증식사업으로 식재된 금강초롱꽃은 야생상태에 있을 때 보다 약 한달 정도 일찍 개화해 치악산 탐방객들의 시선을 사로잡고 있다.현재 치악산 멸종위기식물원내 희귀식물은 사무소와 한국자생식물보전회(회장 조병필)가 자원봉사형식으로 공동관리 중에 있다.한국특산식물이란 한정된 지역에서 생육하는 고유식물을 말하며, 깃대종은 특정지역의 생태·지리·문화적 특성을 반영하는 상징적인 야생 동·식물 생태계의 여러 종 중에 사람들이 중요하다고 인식하고 있는 종이다. 치악산에는 금강초롱꽃(식물)과 물두꺼비(동물) 2종이 지정·보호되고 있다.hoyanarang@권혜민[관련기사][e톡톡] '업데이트' '이벤트'에 신난 유저들유재석 생일 케이크 ""이게 정말 케이크?""혜리 교복패션 포착…단발머리에 깜찍 표정정준하 '노라용팝'…진격의 준하 '점핑'저작권자 뉴스1코리아, 무단전재 및 재배포 금지 ",,2013.08.16. 오전 8:58,49ec4fb33a4f4b03964c795efec37d39,https://news.naver.com/main/read.nhn?mode=LSD&mid=sec&sid1=102&oid=421&aid=0000422182,NAVER_NEWS,"""깃대종"""
168,YTN,'깃대종'을 아시나요?,"동영상 뉴스[앵커]혹시 '깃대종'이라는 말 들어보셨습니까?법으로 보호를 명시한 천연기념물과는 달리 특정 지역을 대표하는 상징적인 야생 동식물을 뜻하는데요.생태계 다양성을 유지하기 위해서라도 '깃대종'에 대한 관심과 보호가 시급하다고 합니다.지 환 기자가 보도합니다.[기자]자주색 초롱꽃이 수줍게 고개를 내밀었습니다.우리나라 중북부 고산지에서만 자라는 한국특산종, 금강초롱꽃입니다.여름철 고온에 고사하기 쉬운 까다로운 식물이지만 다행히 금강초롱꽃으로 유명한 치악산 중턱에 꽃망울을 터트렸습니다.[인터뷰:이용욱, 치악산국립공원사무소]""금강초롱꽃은 한국 특산 식물로 치악산을 대표하는 종입니다. 과거엔 상당히 많았지만 현재 많이 줄어들고 있어 보호펜스를 치고 증식사업을 벌이는 등 보호사업을 진행하고 있습니다.""치악산의 금강초롱꽃처럼 특정 생태계나 지역을 대표하는 동식물을 깃발로 표현해 '깃대종'이라고 합니다.현재 전국 19개 국립공원에서 지정된 깃대종 동식물은 모두 37종.지리산의 반달가슴곰, 다도해의 풍란, 설악산과 월악산의 산양도 모두 깃대종에 포함됩니다.습지 생태계의 깃대종으로 알려진 물웅덩이의 폭군, 물장군.우리나라에 수생곤충 가운데 가장 큰 종류로 올챙이나 작은 물고기의 체액을 빨아 먹습니다.외래 유입종 퇴치 등 생태계의 균형을 조절하는데 큰 역할을 하고 있습니다.[인터뷰:황태환, 국립공원관리공단 자원보전처]""국립공원 생물 종에 대한 관심을 높이는 것은 물론이고 생태계 본연에 대한 공감대 형성, 그리고 보전 활동에 대한 참여를 유도하고자 하는 것이 (깃대종 지정의) 주된 목적이 되겠습니다.""정부 차원에서도 깃대종 지정과 홍보가 이어지고 있습니다.환경부는 올해 정전협정 60주년을 맞아 비무장지대를 대표하는 깃대종으로 두루미를 선정했습니다.특정지역의 생태계를 반영하는 야생 동식물 '깃대종'.한 지역을 대표하는 상징적인 의미를 지닌 만큼 보호나 증식은 물론 시민들의 많은 관심이 꼭 필요한 상황입니다.YTN 지환[haji@ytn.co.kr]입니다.[YTN 화제의 뉴스]▶ 람보르기니가 구워준 소시지…수억짜리 맛?▶ 日 달리는 전철에 '벼락' 직격하는 순간 생생 포착▶ '너구리 크기의 곰 얼굴' 신종 포유동물 발견▶ [연예] 박재범·클라라, 깜짝 커플 섹시 화보...무슨 일?▶ [스포츠] 웽거, ""재앙보단 없는 편이 낫다""...설마 박주영?☞ 네이버 뉴스스탠드에서 'YTN' 설정하기☞ 스마트폰에서도 'YTN 뉴스 App' 이용법☞ PC에서 실시간 YTN HD방송 시청하기[저작권자(c) YTN & Digital YTN. 무단 전재-재배포 금지] ",,2013.08.18. 오전 1:53,55ad1ba0526af25e7deb607225485a8f,https://news.naver.com/main/read.nhn?mode=LSD&mid=sec&sid1=102&oid=052&aid=0000471383,NAVER_NEWS,"""깃대종"""
