,media,title,content,writer,datetime,id,url,source,keyword
424,뉴시스,변산반도국립공원 깃대종 부안종개 7천마리 방류,"【부안=뉴시스】신홍관 기자 = 변산반도국립공원사무소는 변산반도의 깃대종인 부안종개 치어 방류 행사를 26일에 실시한다.부안종개는 변산반도 백천에만 서식하는 한국특산종 미꾸리과에 속하는 소형 민물고기로 22년전 전북대 김익수 교수팀에 의해 첫 발견됐으나 1996년 부안댐 완공으로 서식처가 줄어들어 개체수가 급감했다.이에 따라 변산반도국립공원사무소는 깃대종인 부안종개 보호를 위해 지난해에 이어 생물다양성연구소에서 증식한 치어 방류행사를 가질 예정이다.변산반도사무소는 지난해 환경단체와 학생, 주민 등이 참여한 가운데 양식 치어 6000마리의 부안종개 첫 방류행사를 가진데 이어 올해는 7000마리 치어를 방류할 계획이다.변산반도사무소는 2005년 야생동식물보호법이 개정되면서 멸종위기종에서 제외돼 법적 보호를 받지 못한 부안종개를 올해 부안군어로 지정하고 멸종위기종 환경부 지정에도 노력을 기울이고 있다.변산반도사무소는 앞으로 부안종개 서식 활동에 대해 지속적인 모니터링으로 변화상을 관찰하면서 관련 유관기관 및 지역주민과 함께 부안종개와 그 서식처를 보호할 계획이다.<관련사진 있음>shong@newsis.com ",,2009.10.22. 오후 2:47,adbaebd347600654430e096034026c38,https://news.naver.com/main/read.nhn?mode=LSD&mid=sec&sid1=102&oid=003&aid=0002921715,NAVER_NEWS,"""깃대종"""
425,아시아경제,"LG패션, 지역대표 야생 동식물 보호 캠페인","[아시아경제 최대열 기자]LG패션 아웃도어 브랜드 라푸마는 전국 국립공원에 있는 깃대종 보호 캠페인의 일환으로 깃대종 티셔츠를 24일 출시했다.깃대종이란 특정 지역의 생태·지리·문화적 특성을 반영하는 상징적인 야생 동식물로서 보호해야 할 필요성이 인정된 종을 뜻한다. 지난 2007년부터 국립공원 복원사업을 후원해 온 라푸마는 올해엔 각 지역의 생태환경을 대표하며 깃대 역할을 하는 깃대종 보호를 위해 티셔츠를 출시했다.노란색·오렌지 등 남성용 다섯 가지, 여성용 네 가지 색상으로 출시됐으며 지리산 반달가슴곰·북한산 오색딱따구리·설악산 산양·덕유산 금강모치 등 각 국립공원에서 선정한 동식물 일러스트가 새겨져 있다. 판매수익금 일부는 깃대종 보호사업 기금으로 사용된다.서준원 라푸마 의류BPU장은 ""국립공원 관리공단이 발표한 36종의 깃대종 관련제품을 지속적으로 출시할 예정""이라고 말했다.[관련기사]☞ LG패션, 2Q 고성장 지속..'매수'☞ LG패션, 하반기에 결실 맺을 것..'매수'☞ ""無더위 쿨비즈룩에 맡기세요""[아시아경제 증권방송] - 무료로 종목 상담 받아보세요<로또정보> - 1등 당첨자들의 성공전략은?최대열 기자 dychoi@<ⓒ세계를 보는 창 경제를 보는 눈, 아시아경제(www.asiae.co.kr) 무단전재 배포금지> ",,2010.06.24. 오후 4:39,551de0dd91543500bb278264879a8475,https://news.naver.com/main/read.nhn?mode=LSD&mid=sec&sid1=101&oid=277&aid=0002400207,NAVER_NEWS,"""깃대종"""
426,세계일보,LG패션 라푸마 ‘깃대종 티셔츠’ 출시," LG패션의 아웃도어 브랜드 라푸마는 국립공원의 깃대종 생물을 보호하는 캠페인의 하나로 ‘깃대종 티셔츠’(사진)를 출시했다.     깃대종 생물은 지역의 생태적·지리적 특성을 반영하는 상징적인 야생 동·식물로, ‘깃대종 티셔츠’에는 지리산 반달가슴곰과 북한산 오색딱따구리, 설악산 산양, 덕유산 금강모치 등의 일러스트가 그려졌다. 이 회사는 티셔츠 판매 수익금 일부를 ‘국립공원 깃대종 보호 사업’ 기금으로 기부할 계획이다. 가격은 장당 3만8000원.스포츠월드 정정욱 기자[ⓒ 스포츠월드 & Sportsworldi.com, 저작자표시+비영리+변경금지]<세계닷컴은 한국온라인신문협회(www.kona.or.kr)의 디지털뉴스이용규칙에 따른 저작권을 행사합니다.> ",,2010.06.27. 오후 4:19,1196c746541de4d4743e5db0bcc7791c,https://news.naver.com/main/read.nhn?mode=LSD&mid=sec&sid1=103&oid=022&aid=0002154077,NAVER_NEWS,"""깃대종"""
427,SBS,신발 한 켤레 사면 한 켤레는 기부…'착한 소비',"동영상 뉴스<앵커>소비 중에도 착한 소비가 따로 있습니다. 내가 필요한 걸 사면 일정액을 기부하는 방식입니다.권란 기자입니다.<기자>깔끔한 모양에 편안한 착용감으로 인기를 끌고 있는 신발입니다.고객이 이 신발 한 켤레를 사면 제조업체는 같은 신발 한 켤레를  제3세계 어린이들에게 전해줍니다.이런 방식으로 지난 2006년 출시 이후 지금까지 60만 켤레가 지구촌 오지의 맨발 어린이들에게 전달됐습니다. 장화에 알록달록 예쁜 그림이 그려져 있습니다.저소득층 어린이 10명이 그린 그림입니다.이 장화들이 전시되는 두 달 동안 장화 한 켤레를 사게되면 그 수익금의 일부가  이 그림을 그린 아이들의 꿈을 위해 쓰이게 됩니다.[김현정/서울 대치동 : 제가 꼭 필요한 걸 사게 되면서 기부를 하게 되면 더 좋을 것 같아서 기분도 좋고요.]티셔츠에 지리산의 반달가슴곰, 설악산의 산양처럼 각 지역의 생태환경을 알려주는 이른바 '깃대종' 동물들이 그려져 있습니다.지금까지 7천 장이 팔렸고 판매 수익금의 1%는 깃대종 보호에 쓰입니다.이 백화점은 친환경 제품을 파는 입점업체로부터 받는 임대료와 수수료를 환경재단에 전액 기부하고 있습니다.[임윤호/백화점 과장 : 소비자가 직접 참여할 수 있어 기업의 이미지 재고 및 사회 공헌에 이바지 할 수 있어 확산되는 추세입니다.]소비를 통한 기부, 기부에 대한 저항감을 없애면서 나도 좋고 남에게도 도움을 주는 건전한 소비문화로 자리잡고 있습니다.권란 harasho@sbs.co.kr관/련/정/보◆ 2010 미스코리아 진 정소라, 상금 전액 기부◆ [나눔의행복] 황기순 '사랑더하기 사이클대장정'◆ 컬투, 장애인 위해 티셔츠 5천벌 기부◆ 배용준·김현중 일본 첫 동반 나들이, 뜨거운 관심[SBS기자들의 생생한 취재현장 뒷이야기 '취재파일']저작권자 SBS&SBS콘텐츠허브 무단복제-재배포 금지 ",,2010.08.18. 오전 8:05,533a3bc48d604b78e20d7cbbea73e1a5,https://news.naver.com/main/read.nhn?mode=LSD&mid=sec&sid1=101&oid=055&aid=0000187722,NAVER_NEWS,"""깃대종"""
428,한국경제,스타와 함께 하는 ‘깃대종 보호 캠페인’,"'라푸마'에서 깃대종 보호 캠페인 화보 촬영을 진행했다.라푸마는 지난 2010년부터 한반도 깃대종의 꺼져가는 생명을 살리기 위해 '국립공원 깃대종 보호 캠페인'을 벌이고 있다.이번 캠페인은 김재욱, 김민준, 현우, 이청아, 서효림, 조하랑이 참여, 깃대종을 일러스트로 한 라푸마 깃대종 티셔츠와 초경량 방수 재킷으로 스타일리시하고 세련된 감각을 선보였다.깃대종은 특정 지역의 생태, 지리, 문화적 특성을 반영하는 상징적 야생 동식물로서 사람들이 보호해야 할 필요성을 인정하는 종을 말한다.국립공원에서는 지리산의 반달곰, 설악산의 산양, 속리산의 하늘다람쥐 등 멸종위기에 있거나, 천연기념물로 지정된 동식물을 '국립공원별 깃대종'으로 선정, 관리하고 있다.라푸마 깃대종 티셔츠의 판매 수익금 일부는 국립공원 깃대종 보호 사업 기금으로 쓰일 예정이다.한경닷컴 키즈맘뉴스 김연정 기자(kyj@kmomnews.com)[KIDSMOM관련슬라이드보기] ",,2011.04.12. 오전 9:20,be9686fe0731ca8c8ce98009e522a3cf,https://news.naver.com/main/read.nhn?mode=LSD&mid=sec&sid1=103&oid=015&aid=0002430982,NAVER_NEWS,"""깃대종"""
429,머니투데이,[★포토]라푸마와 스타들이 함께한 '깃대종'보호캠페인 화보③서효림,"[머니투데이 지성희 인턴기자]↑(사진=서효림/LG패션 '라푸마'제공)아웃도어 브랜드 '라푸마'에서 스타들과 함께 깃대종 보호 캠페인 화보 촬영을 했다.라푸마는 지난 2010년부터 한반도 깃대종의 꺼져가는 생명을 살리기 위해 '국립공원 깃대종 보호 캠페인'을 벌이고 있다. 이번 화보는 김재욱, 김민준, 현우, 이청아, 서효림, 조하랑이 참여, 깃대종을 일러스트로 한 라푸마 깃대종 티셔츠와 초경량 방수 재킷을 스타일리시하고 세련된 감각으로 연출해 화제다.'깃대종'은 특정 지역의 생태, 지리, 문화적 특성을 반영하는 상징적 야생 동식물로서 사람들이 보호해야 할 필요성을 인정하는 종을 말한다. '라푸마' 깃대종 티셔츠의 판매 수익금 일부는 국립공원 깃대종 보호 사업 기금으로 쓰이며, 화보촬영에 참여한 스타들은 환경 지킴 팁을 제안했다.◇ 스타가 제안하는 환경 지킴 TIP1.현우 - 커피숍에서 일회용 컵 대신 머그컵을 사용하고 물통을 가지고 다닌다.2.김재욱 - 에코백을 장바구니 대용으로 가방에 항상 가지고 다니다.3.서효림 - 집에서는 물론 밖에서도 분리수거를 철저히 하여 쓰레기를 줄이기 위해 노력한다.4.조하랑 - 깨끗한 물을 위해 샴푸나 보디 젤 등 세제를 적게 사용한다.5.이청아 - 이메일 청구서로 바꾸고 이면지를 활용하는 등 종이 사용을 최소화한다.6.김민준 - 탄소배출을 줄이기 위해 자동차보다는 스쿠터나 자전거를 이용한다.인기 스타들과 함께 한 '라푸마'의 깃대종 화보는 잡지 엘르, 에스콰이어 등에서 만나볼 수 있다.[스타일M]뽀얀얼굴 女피팅모델 종결자! 봄 스타일링~[관련기사]☞ '샤넬' 내달부터 가격 인상, 백값이 차값되나☞ 빅토리아,립스틱모델…'키스를 부르는 입술'☞ 배우 아라, 컬러 스타일링으로 '업타운걸'매력 발산☞ 워킹화, 운동할 때만? 의외의 스타일링이 멋스럽네☞ 환절기 예민해진 두피와 모발을 달래자- 오늘의 증권정보 '상승포착! 특징주!'- 대세는 중소형주다! / 실전대회 수상자 추천주지성희인턴기자 rung2@<저작권자 ⓒ '돈이 보이는 리얼타임 뉴스' 머니투데이, 무단전재 및 재배포 금지> ",,2011.04.20. 오후 3:17,ea75d3e7608eec9bd6832d7521724bd3,https://news.naver.com/main/read.nhn?mode=LSD&mid=sec&sid1=103&oid=008&aid=0002522438,NAVER_NEWS,"""깃대종"""
430,헤럴드POP,소백산국립공원 25일 전후 모데미풀 향기 가득,"4월 꽃의 계절을 맞이하여 소백산국립공원에도 다양한 야생화들이 탐방객 들을 맞이하고 있다. 노란색 생강나무와 분홍색 진달래가 입구에서 탐방객을 맞이하면, 탐방로변 양지바른 곳에서는 제비꽃과 산괴불주머니 등이 꽃을 피워, 오는 이들의 마음을 더욱 따뜻하게 해주고 있다.특히 비로봉 주목군락지를 하얗게 수놓는 모데미풀은 4월 25일 이후, 예년과 비슷한 시기에 개화할 것으로 보인다. 모데미풀은 소백산국립공원의 깃대종으로 우리나라에만 자생하는 특산식물이며, 학술적 가치가 매우 높다. 국내 최대 군락지가 소백산에 있어 지속적인 조사ㆍ모니터링을 시행하고 있다.양기식 소백산국립공원북부사무소 소장은 “봄이 되면 모데미풀 뿐 아니라 노루귀, 너도바람꽃, 홀아비바람꽃, 피나물, 처녀치마 등 재밌는 이름을 가진 아름다운 야생화들을 볼 수 있기 때문에 많은 국민들이 오셔서 소백산국립공원의 아름다움을 보고 즐기셨으면 한다”고 말했다.<박도제 기자 @bullmoth>pdj24@heraldm.com▶ [오늘도 상한가]1천만원 계좌가 3억 된 사연은?▶ 겨울철 알레르기 비염, 마사지가 해답!- 헤럴드 생생뉴스 Copyrights ⓒ 헤럴드경제 & heraldbiz.com, 무단 전재 및 재배포 금지 - ",,2011.04.22. 오전 11:36,f463416554751b7ce375291289617d14,https://news.naver.com/main/read.nhn?mode=LSD&mid=sec&sid1=102&oid=112&aid=0002188672,NAVER_NEWS,"""깃대종"""
431,연합뉴스,"대구환경청, 왕피천 깃대종에 '산양.금강송'","(대구=연합뉴스) 이강일 기자 = 대구지방환경청은 경북 울진의 왕피천 유역 생태.경관보존지역의 깃대종(지역의 생태.지리적 특성을 반영하는 상징적 동식물)으로 산양과 금강송을 선정했다고 29일 밝혔다.소과의 포유류인 산양은 멸종위기야생동식물 1급이자 천연기념물 217호이며, 국제적으로는 CITES(국제 야생동식물 멸종위기종 거래에 관한 조약)로 관리되는 상업적으로 거래가 금지된 동물이다.또 금강석과 같이 단단하다고 이름이 붙은 금강송은 태백산맥 깊은 곳에서만 자라는 늘푸른큰키나무로 나이테가 조밀해 잘 썩지 않고 나무의 재질이 좋아 예로부터 임금의 관이나 궁궐.사찰의 대들보 등으로 사용돼 왔다.대구환경청 관계자는 ""산양과 금강송은 왕피천 유역의 생태.경관보전지역 뿐 아니라 주변 다른 지역의 경관도 상징하는 만큼 이와 관련된 지역주민의 소득 사업 등에도 이용될 수 있을 것으로 기대한다""고 말했다.leeki@yna.co.kr<모바일 애플리케이션> <포토 매거진><저작권자(c)연합뉴스. 무단전재-재배포금지.> ",,2011.06.29. 오전 9:12,7a9fa1762956d74c0105e8b6a0897fd1,https://news.naver.com/main/read.nhn?mode=LSD&mid=sec&sid1=102&oid=001&aid=0005136683,NAVER_NEWS,"""깃대종"""
432,뉴시스,계룡산국립공원 '깃대종' 호반새,"【대전=뉴시스】박희송 기자 = 국립공원관리공단 계룡산국립공원사무소는 14일 오후 2시 계룡산국립공원 깃대종인 '호반새'와 '이끼도롱뇽' 보호·관리를 위한 탐방프로그램을 공주시 반포면 동학사1로 입구인 동학사탐방지원센터에서 행사를 갖는다고 8일 밝혔다. 사진은 계룡산국립공원 깃대종 '호반새'. (사진=국립공원관리공단 계룡산국립공원사무소 제공)photo@newsis.com★ 손 안에서 보는 세상, 모바일 뉴시스<저작권자ⓒ 공감언론 뉴시스통신사. 무단전재-재배포 금지.> ",,2011.11.08. 오전 9:52,47e9fd65976f80959f587af623712d83,https://news.naver.com/main/read.nhn?mode=LSD&mid=sec&sid1=102&oid=003&aid=0004178819,NAVER_NEWS,"""깃대종"""
433,경향신문,"수원시, 멸종위기 ‘수원청개구리’ 복원한다","경기 수원시는 멸종위기에 처한 ‘수원청개구리’ 복원 작업에 착수한다고 4일 밝혔다. 이를 위해 수원청개구리의 서식지 실태조사와 복원에 나서기로 했다.수원청개구리는 1980년 수원시 서둔동 소재 농촌진흥청 옆에서 처음 발견됐다. 조사 결과 국내 고유종으로 전 세계에서 경기만 주변에서만 서식하는 것으로 밝혀졌다.수원청개구리는 지명을 이름으로 가진 국내 유일의 개구리다. 짝짓기 때 ‘꽥꽥’ 소리를 내는 일반 청개구리와 달리 낮은 ‘윙~윙~’ 소리를 내는 것이 특징이다.환경부는 서식환경이 변화하면서 수원청개구리의 개체 수가 급격히 줄자 지난 1월 말 멸종위기종으로 지정했다.수원시는 수원청개구리 서식지 실태조사를 통해 지리산 반달가슴곰이나 북한산 오색딱따구리처럼 수원지역의 생태계 수준을 대표할 수 있는 깃대종(flagship species)으로 복원할 계획이다.시는 환경단체와 함께 황구지천 지류 주변을 대상으로 서식지 실태조사를 벌여 기초자료를 확보한 뒤 세부 보존 계획을 마련키로 했다. 이어 올해 말까지 장안구 율정동 밤밭저수지 주변 생태공원 일부(1144㎡)에 수원청개구리 서식지를 조성한다.시는 개구리가 서식하는 칠보산 인근 지역 농가들과 협약을 맺고 해당지역 쌀을 전량 수매키로 했다. 농가는 대신 농약을 쓰지 않고 이곳에서 생산한 쌀을 ‘수원청개구리’ 브랜드로 판매한다.또 청개구리 복원 지원을 위한 조례를 만들고 보존의 날도 지정·운영하기로 했다.염태영 수원시장은 “개구리 보존 사업을 통해 이산화탄소 감축과 도시농업 활성화의 계기로 만들 것”이라며 “수원청개구리를 천연기념물로 지정하기 위한 시민운동도 벌일 계획”이라고 말했다.<경태영 기자 kyeong@kyunghyang.com>경향신문 ‘오늘의 핫뉴스’▶ 성매수 들통난 공무원들… 핑계가 가관▶ [단독] 아이 얼굴에 화상… 국물女 결국▶ 3대 가족 사망사건… 범인 잡고보니, 경악▶ “내 애인이 야한 영화에…” 톱스타 결별 충격▶ “급한데 휴대폰 좀…” 빌려줬더니, 황당모바일 경향 [New 아이폰 App 다운받기!] | 공식 SNS 계정 [경향 트위터] [미투데이] [페이스북] [세상과 경향의 소통 Khross]- ⓒ 경향신문 & 경향닷컴(www.khan.co.kr), 무단전재 및 재배포 금지〈경향닷컴은 한국온라인신문협회(www.kona.or.kr)의 디지털뉴스이용규칙에 따른 저작권을 행사합니다.〉 ",,2012.03.04. 오후 11:41,b90ac86edbd6adce48ec8fc82d3aee3a,https://news.naver.com/main/read.nhn?mode=LSD&mid=sec&sid1=102&oid=032&aid=0002197850,NAVER_NEWS,"""깃대종"""
434,매일신문,"[어린이 책] 도서관에 간 여우/…우표만 알고 있는 유네스코…/점박이물범, 내년에도 꼭 만나!","▨도서관에 간 여우/로렌츠 파울리 글/카트린 쉐어 그림/노은정 옮김/사파리/36쪽/9천800원도서관을 배경으로 여우와 생쥐, 닭의 흥미진진한 이야기 속에서 도서관을 경험하지 못한 어린이들을 도서관과 가깝게 이어주는 그림책이다.생쥐는 자신을 잡아먹으러 도서관에 들어온 여우에게 도서관에서 지켜야 할 규칙을 알려 주며 재치 있게 위기를 피한다. 읽은 책은 도로 책꽂이에 꽂아 두어야 하고, 책을 빌릴 땐 도서관 카드를 만들어야 하며, 빌릴 수 있는 책과 대출 기간에 대해서도 빠뜨리지 않고 조언해 준다.도서관에 대해 잘 모르는 엉뚱한 여우는 점점 도서관에 흥미를 느끼고 책을 읽는 재미에 빠져들게 된다. 그러한 여우를 보고 있노라면 영락없는 어린이의 모습 그대로라 절로 미소 짓게 된다. 낯설었던 도서관이 특별한 곳으로 바뀌어 가는 과정을 통해 가보지 않은 도서관, 혹은 멀게 느껴졌던 도서관이 한층 가깝게 느껴진다. 책을 읽고 아이 손잡고 도서관에 가 보자.▨쉿! 우표만 알고 있는 유네스코 세계 유산 엿보기/김경희 글/유남영 그림/글고은/208쪽/1만2천원우정사업본부에서 추천하는 '우표만세 시리즈'로 1권 우리 역사와 문화 엿보기, 2권 세계역사와 문화 엿보기에 이은 세 번째 책이다.인류의 조상은 수백, 수천 년 동안 세계 곳곳에 소중한 유산을 아주 많이 남겨 놓았다. 이들 유산에는 지구촌 조상들의 땀과 역사, 문화와 풍습, 지혜 등이 고스란히 배어 있다. 세월이 흐르면서 전쟁이나 자연재해, 관리 소홀로 파괴되고 사라질 위기에 놓여 유네스코에서는 소중한 유산을 보호하고 잘 관리하여 후손에게 물려주기 위해 1972년부터 세계 유산으로 지정해 보호하고 있다.방학 숙제로 세계 유산 우표를 수집하는 우정이와 시간 여행 안내자인 코비와 함께 지구촌 곳곳의 세계 유산을 찾아간다. 우리나라의 창덕궁, 경주 역사 지구, 불국사와 석굴암 등을 비롯하여 아시아와 유럽 남미의 우표 속에 담겨 있는 수많은 나라의 역사, 문화, 사회, 정치, 경제, 인물들에 대한 알아본다.▨점박이물범, 내년에도 꼭 만나!/녹색연합 글/남성훈 그림/웃는 돌고래/48쪽/1만2천원한때 서해에 사는 점박이물범은 8천 마리가 넘었지만 지금은 백령도에서 2천300마리 정도밖에 관찰되지 않아 천연기념물로 보호되고 있다. 이러다간 독도에서 사라져 간 강치처럼, 점박이물범도 백령도에서 사라져 버릴지도 모른다. 옛날에는 사람들이 너무 많이 잡아들여서 문제였고, 최근에는 지구온난화 때문에 어려움을 겪고 있다. 점박이물범이 사라진 바다에서 사람들이 행복할 리 없다.주인공 아이 '범이'가 만난 점박이물범 '별이'와의 우정을 을 통해 사람들이 점박이물범을 좋아하고 아껴 주어야 점박이물범들이 더 오래도록 우리 곁에 머물 것임을 말한다.'녹색연합과 함께하는 대한민국 깃대종'시리즈의 첫째 권으로 백령도 점박이물범에 이어 울진의 산양, 강원도의 하늘다람쥐 등의 이야기로 계속 이어질 예정이다.Copyrights ⓒ 1995-, 매일신문사 All rights reserved. 무단 전재-재배포 금지 ",,2012.04.21. 오전 9:39,1cbdb443cf761802697513901340d6fd,https://news.naver.com/main/read.nhn?mode=LSD&mid=sec&oid=088&aid=0000242069,NAVER_NEWS,"""깃대종"""
435,아시아경제,"""덕유산 구천동계곡 금강모치 지켜라""","[아시아경제 김수진 기자]깨끗한 물에서만 사는 물고기 '금강모치'. 잉어과에 속하는 어종으로 몸길이는 7~8cm정도 된다. 서해로 흐르는 한강과 임진강 최상류, 대동강, 압록강 등에 분포하며 1급수를 나타내는 지표종이다. 또한 산소가 풍부하고 수온이 낮은 물에서만 서식해 2010년에는 기후변화 생물지표종으로도 지정됐다.특히 덕유산 국립공원에서는 '깃대종(Flag species)'으로 지정돼있다. 깃대종은 국립공원을 상징하는 야생 동식물이다. 덕유산국립공원의 깃대종은 금강모치와 구상나무. 금강모치는 한강과 임진강을 제외하면 덕유산국립공원 구천동 계곡에서만 볼 수 있다. 그러나 최근 외래어종 때문에 금강모치 수가 줄어들면서 덕유산 국립공원이 대책 마련에 나섰다.환경부 국립공원관리공단은 10일 금강모치 보호를 위한 외래어종 퇴치사업에 나선다고 밝혔다. 무지개송어와 산천어가 어린 금강모치를 잡아먹어 개체 수가 줄어들고 있다는 것. 무지개송어는 1965년 미국에서 양식용으로 들여 온 외래어종이다. 영동지역을 중심으로 분포하던 산천어가 덕유산 구천동 계곡에서 처음 발견된 것은 2005년. 최근에는 치어들이 물살을 거슬러 올라가며 서식영역을 확대하고 있어 금강모치 개체군 감소에 영향을 주고 있다는 설명이다.공단은 우선 6~7월에 무지개송어와 산천어가 서식하는 깊은 소를 찾아 잠수부가 작살을 이용해서 직접 잡거나 투망을 이용해 잡을 계획이다. 산천어는 산란기인 9~10월 무렵 산란터로 몰리는 습성을 이용해 집중 포획한다. 또한, 금강모치 개체수를 증가시키기 위해 무주군과 함께 금강모치 치어 3000마리를 10월께 방사할 예정이다.김수진 기자 sjkim@<ⓒ세계를 보는 창 경제를 보는 눈, 아시아경제(www.asiae.co.kr) 무단전재 배포금지>[관련기사]▶ ""동대문 지하서 산 '샤넬' 진짜일 수도 있어""▶ '박진영' 그 많던 재산이 어쩌다 몇달만에…▶ ""여자친구 비명에 뛰어갔더니 화장실에서…""▶ 내 자녀의 숨은 키 10cm를 찾아라▶ ""김태희쯤이야"" '엄친딸' 최송현 금융맨이… ",,2012.06.10. 오후 12:00,eea794396fd786dcea5005fca0a14f24,https://news.naver.com/main/read.nhn?mode=LSD&mid=sec&sid1=102&oid=277&aid=0002797059,NAVER_NEWS,"""깃대종"""
