,media,title,content,writer,datetime,id,url,source,keyword
1,서울신문,"[현진오의 野, 야생화다!] 모데미풀","[서울신문]일정한 영역 안에서만 자라는 식물을 고유(固有)식물 또는 특산(特産)식물이라고 한다. 세계적으로는 대한민국에서만 살면 한국특산이 되는 것인데, 그게 종(種) 수준이면 한국특산종, 속(屬) 수준이면 한국특산속이라 한다. 종들이 모여서 속을 이루므로 한국특산속은 한국특산종에 비해 학술적으로 의미가 더욱 크다. 이러한 한국특산속은, 학자에 따라서 견해가 조금씩 다르기는 하지만, 일반적으로 개느삼속, 금강인가목속, 금강초롱꽃속, 모데미풀속, 미선나무속, 제주고사리삼속 등 6가지로 일컬어진다. 금강산 일대에서만 자라는 금강인가목속을 제외하고는 모두 남한에서 볼 수 있다. 한국특산종은 400여 종류로 알려져 있고, 한국특산과(科)는 없다.모데미풀은 한국특산속인 모데미풀속을 이루는 유일한 종이다. 일본인 학자에 의해 지리산 부근에서 처음 발견되었다. 남원시 운봉면의 모데미마을에서 발견되어 모데미풀이라는 이름이 붙여졌다고 하지만, 모데미마을을 아직까지 찾지 못하였다. 운봉마을 근처에서 처음 발견된 것은 사실이라 하더라도 모데미의 어원은 어떤 마을의 이름이 아니라 ‘무넘이’나 ‘무덤’을 일본식으로 발음한 것이 아닌가 싶기도 하다.한라산부터 금강산까지 분포하여 한반도 중부와 남부의 꽤 넓은 범위에서 자라고 있지만 아무데서나 자라지는 않는다. 높은 산의 습윤한 곳에서만 자라는데 덕유산, 오대산, 광덕산, 태백산, 점봉산 등지에서 발견된다. 뿌리가 겨울에도 죽지 않고 살아남아 있는 여러해살이풀로서 4월 초순부터 눈 속에서 꽃을 피우기 시작해 5월 초순에 절정기를 맞는다. 꽃잎처럼 보이는 크고 하얀 꽃받침이 꽃의 바깥을 화려하게 장식하고, 안쪽에는 노란 꿀샘으로 변한 꽃잎과 수술, 그리고 암술이 자리잡고 있다. 꽃이 매우 예쁘므로 원예적인 가치가 높은 데다, 세상 어디에도 없는 토종식물이므로 그 가치는 값을 매기기 어려울 정도다.소백산에서는 해발 1300m 이상의 계곡 주변과 능선의 활엽수림 밑에서 큰 무리를 지어 자란다. 소백산에 가장 많은 개체가 자라고 있는 것으로 보아 이곳에서 새로운 종으로 분화한 것으로 추정된다. 과히 소백산의 꽃이라 할 만하고, 소백산국립공원을 대표할 만한 꽃으로서 사람들에게 감명을 주기에도 충분하므로 소백산의 깃대종 가운데 하나로 삼을 만하다.소백산에 그렇게 지천으로 피어 있는 모데미풀을 귀중한 한국특산속 식물로서 알아보는 이가 많지 않아 안타까울 때가 있다. 이맘때쯤 수학여행으로 소백산을 찾는 학생들이 많은데, 교사나 산행안내자가 이 특산속 식물에 대해 학생들에게 설명하는 장면을 한번도 보지 못하였다.모데미풀은 소백산 등 몇몇 산에서는 흐드러지게 많지만 지구 전체로 보면 한반도 일부 지역에만 국지적으로 분포하는 희귀식물이다. 지구상에서 보전가치가 높음은 물론이다. 특산종 모데미풀은 한반도에서 사라지면 지구상에서 멸종하는 것이므로 우리에게 보전책임이 있다.동북아식물연구소장“맛있는 정보! 신선한 뉴스!”- Copyrights ⓒ서울신문사. 무단 전재 및 재배포 금지 - ",,2007.05.12. 오전 12:00,0c18ee700f34fbbd277893e54e7f233a,https://news.naver.com/main/read.nhn?mode=LSD&mid=sec&sid1=103&oid=081&aid=0000132950,NAVER_NEWS,"""깃대종"""
2,노컷뉴스,"""생태체험"", 공원이용프로그램 신청하세요","서울시 푸른도시국에서는 여름방학을 즐길 수 있는 공원이용프로그램을 준비하고 25일 오전 10시부터 서울의 공원 홈페이지(http://parks.seoul.go.kr)에서 공원별로 접수를 받는다고 밝혔다.월드컵공원에서는 환경부 지정 멸종위기야생동물 Ⅱ급인 ‘맹꽁이’를 깃대종으로 지정하고 7월 특별 프로그램으로 ‘맹꽁이 탐사교실’을 운영한다. ‘맹꽁이 탐사교실’은 월드컵공원내 ‘평화의 공원’과 ‘하늘 공원’에서 6월 30일부터 7월 8일까지 총 4회에 걸쳐 맹꽁이의 울음소리를 들을 수 있는 저녁 6시부터 진행된다.평화의공원 난지연못 주변에 조성된 수생식물 전시장에서는 ‘수생식물 관찰교실’이 운영되며, ‘곤충채집과 관찰’, ‘나비관찰교실’, ‘식물표본만들기’ 등 다양한 체험 프로그램이 준비되어 있다.서울숲에서는 여름방학을 맞는 어린이들을 위한 ‘여름방학 또래여행’, ‘여름방학 캠프’’가 운영되며 ‘난 곤충이 좋아’, ‘습지교실’, ‘숲속이야기’, ‘조물조물 숲속 공작교실’, 등 다양한 자연체험 프로그램이 운영된다.남산공원에서는 자연체험여행을 떠나는 ‘남산에서 놀자’ 등이, 낙산공원에서는 공원과 인근 마을 골목길에 설치된 미술품을 미술 전문가와 함께 감상하는 ‘공원에서 그림읽기’ 가, 용산공원에서는 공원내 전시된 야외조각품을 감상할 수 있는 ‘공원예술교실’이, 독립공원에서는 공원의 나무에 대해 알아보는 ‘공원나무알기교실’이 운영된다.여의도공원에서는 어린이와 가족을 대상으로 ‘현미경 관찰교실’과 ‘생태숲 관찰교실’이 운영되며, 영등포공원에서는 ‘어린이 생태문화교실’이 진행된다. 보라매공원에서는 시원한 분수를 배경으로 나무그늘아래 퓨전음악을 감상할 수 있는 ‘수변음악회’와 유아를 위한 ‘유아숲학교’, 방학을 맞은 청소년을 위한 ‘길거리농구대회’가 열린다.시민의숲에서는 풀벌레 소리를 들으며 맘껏 뛰어 노는 ‘어린이숲교실’이, 사능․갈매수목학습원에서는 가족이 함께 놀면서 자연을 느끼고 배우는 ‘참살이 가족교실’이 운영된다.길동자연생태공원에서는 ‘여름 생태학교’, ‘신나는 길동’, ‘벌들의 집짓기’,‘숲속의 청소부 버섯’, ‘물에 사는 식물’ 등 생태학교 프로그램과 자연관찰 체험교실이 진행되며, 길동생태문화센터에서는 ‘나뭇잎 한지엽서 만들기’, ‘종이죽으로 곤충가면 만들기’, ‘풀잎공예’ 등이 진행된다.어린이대공원에서는 여름축제가 방학기간에 맞추어 시작되며, 신나는 물놀이를 즐길 수 있는 수영장이 개장한다. 또한, 자연을 느끼고 체험하는 ‘생태체험프로그램’과 동물학습 프로그램인 ‘에코스쿨’, ‘코코스쿨’ 이 운영되며, ‘낙타 타기’, ‘미니 말 타기’, ‘물개,침팬치 공연’, ‘코끼리쇼’ 등 다양한 동물 체험이 진행된다.CBS사회부 김영태 기자 great@cbs.co.kr(대한민국 중심언론 CBS 뉴스FM98.1 / 음악FM93.9 / TV CH 412)<저작권자 ⓒ CBS 노컷뉴스(www.nocutnews.co.kr) 무단전재 및 재배포 금지 > ",,2007.06.25. 오전 11:15,8438addb5e7813d2289d6862acf2a2ed,https://news.naver.com/main/read.nhn?mode=LSD&mid=sec&sid1=102&oid=079&aid=0000169176,NAVER_NEWS,"""깃대종"""
3,뉴시스,"현대차, 태화강에 멸종위기 참게 1만마리 방류","현대차, 태화강에 참게 방류【울산=뉴시스】2005년부터 2년간 울산권역에 꼬리명주나비 복원사업을 성공적으로 마무리한 현대자동차가 울산시와 함께 태화강 동남참게와 각시붕어, 풀흰나비 복원 등 2단계 자연생태자원 복원사업에 나선다고 10일 밝혔다.현대차는 이를 위해 이날 오후 울산 중구 태화강 대숲생태공원 남쪽 강변 서식지에 어린 참게 1만마리를 방류하는 서식지 복원행사를 가졌다.현대차는 앞으로도 2009년까지 매년 1만마리 이상의 어린 참게를 태화강에 지속적으로 방류함으로써, 생태하천 태화강 수역을 안정적인 동남참게 서식지로서 복원해갈 계획이다.동남참게는 1962년 울산공업단지 조성 이후 황어, 연어 등과 함께 차츰 태화강에서 자취를 감춰 왔으나 최근 태화강 정화노력에 힘입어 수질이 점차 되살아나면서 중·하류지역에서 아주 드물게 발견되고 있는 어족이다.따라서 현대차의 이번 참게 방류는 태화강 수역을 예전과 같은 풍부한 토종 생태서식지로 회복시키는 데 청신호가 될 것으로 기대된다.민물참게는 최근 친환경 벼농사의 한 방법으로 이용되기도 하며 참게장이나 참게 매운탕의 재료로 활용되며 옛부터 우리의 입맛을 돋워 오기도 했는데, 수중 생태계의 청소동물로 건강한 하천생태계를 유지하는 생물자원으로 알려진 참게가 오는 2009년까지 복원되면 태화강은 보다 완벽한 생태하천으로 되살아날 전망이다.현대차 환경방제팀 강창희 과장은 ""꼬리명주나비 복원을 성공리에 마무리한 것처럼 현대차가 추진하는 제2단계 자연생태자원 복원사업도 모두 순조롭게 추진될 것""이라며 ""동남참게의 완벽한 서식지 복원을 위해서 2008년에는 선바위 부근에 2009년에는 번영교 부근에도 어린 참게를 지속적으로 방류하게 될 것""이라고 밝혔다.한편 현대차는 이달부터 시작하는 2단계 생태복원사업을 태화강 수역에 집중키로 했다.이에 따라 이번 동남참게 복원에 이어 한국의 특산종이며 태화강의 깃대종으로 지정된 각시붕어를 2009년까지 복원키로 했으며, 하천 생태환경의 지표종으로 불리는 멸종위기의 풀흰나비도 2010년까지 태화강 일원에 복원해나갈 계획이다.<관련사진 있음>박선열기자 psy@newsis.com ",,2007.08.10. 오후 5:11,13186ad41c7539e63cdb9dfc63f06fb7,https://news.naver.com/main/read.nhn?mode=LSD&mid=sec&sid1=102&oid=003&aid=0000523356,NAVER_NEWS,"""깃대종"""
4,오마이뉴스,"""국립공원 1호 지리산의 '깃대종'은?""","[오마이뉴스 윤성효 기자]▲ 국립공원지리산사무소는 지리산의 깃대종을 선정하는 작업에 나섰다.ⓒ2007 국립공원지리산관리사무소""우리나라 국립공원 1호인 지리산의 '깃대종'을 골라 주십시오.""국립공원지리산관리사무소는 깃대종을 선정하는 작업에 들어갔다. 깃대종은 생태적.사회적.문화적으로 사람들이 중요하다고 인식하여 보호할 가치가 있다고 생각하는 종을 말한다.이는 1993년 국제연합환경계획(UNEP)이 발표한 '생물다양성 국가 연구에 관한 가이드라인'에서 제시한 개념으로, 우리나라의 경우 강원도 홍천의 '열목어'와 김천시의 '은행나무', 거제도의 '고란초', 울산광역시의 '각시붕어', 부천시의 '복사꽃' 등이 깃대종으로 선정되어 있다.지리산사무소는 14일 인터넷 홈페이지(http://jiri.knps.or.kr)에 ""깃대종 함께 찾아 보아요""라는 제목의 홍보창을 띄워 등산객과 네티즌들의 참여를 유도했다.우선 '깃대종' 선정의 필요성부터 물었는데, ▲깃대종에 대해 알고 있는지에 대해 먼저 물었고, 다음으로 ▲지리산국립공원을 대표하는 깃대종을 선정하여 관리하는 것이 필요하다고 생각하느냐고 물었다.그런 다음 ""지리산의 깃대종을 선정한다면 어느 종이 가장 적합하다고 생각하는지""를 물은 뒤, 9개의 종을 제시하면서 2개만 고르도록 했다. 지리산사무소가 '깃대종' 예비후보로 제시간 9종의 동ㆍ식물은 다음과 같다.▲ <b>얼룩새코미꾸리</b> 멸종위기야생동물1급이며 낙동강 수계에서 제한적으로 분포하고 있으며 산간계류의 맑은 물에서만 서식하는 저서성 어종이다. 하천의 토사 유입등에 의해 쉽게 영향을 받을 수 있는 종이다.ⓒ2007 국립공원지리산관리사무소▲ <b>구렁이</b> 멸종위기야생동물1급으로 개체수 또한 급격히 줄어든 종으로 지리산일대의 암자주변이나 자연마을지구의 담장 등에서 관찰되고 있다. 현대화되는 가옥 등에 의해 서식환경이 나빠지고 있다.ⓒ2007 국립공원지리산관리사무소▲ <b>수리부엉이</b> 수리부엉이는 국내 올빼미과 조류중 가장 큰 종으로 멸종위기종 2급(천연기념물 324호)으로 지정되어 사람의 발길이 닿지 않는 깊은 숲속에 서식한다. 수리부엉이는 분명 텃새이지만 지금은 사람의 출입이 통제되는 산불 방지기간 중 봄에 먹이를 사냥하기 위해 나타나는 야간에만 소수의 개체만이 겨우 관찰이 가능하다.ⓒ2007 국립공원지리산관리사무소▲ <b>만병초</b> 지리산이 자생 남방한계선으로 판단되는 중요한 종으로 과거 무분별하게 남확되거나 채취되었던 종이며 자생지역인 칠선계곡 등을 자연휴식년제와 국립공원특별보호구제도로 출입을 엄격하게 통제하고 보호를 하면서 점차 관찰이 용이해지고 있는 종이다.ⓒ2007 국립공원지리산관리사무소▲ <b>큰소쩍새</b> 소쩍 소쩍 울음을 우는 소쩍새와 유사하게 생긴 큰소쩍새는 사람이 다가가거나 위협을 느끼면 부리를 이용하여 딱딱 소리를 낸다. 한때 자주 관찰되었던 큰소쩍새는 최근 지리산이 도로에 의해 나뉘면서 로드킬(Road-Kill) 되는 횟수가 늘고 있다(천연기념물 324호).ⓒ2007 국립공원지리산관리사무소뉴스게릴라들의 뉴스연대 - 모든 시민은 기자다 ⓒ오마이뉴스(http://www.ohmynews.com), 무단 전재 및 재배포 금지 - ",,2007.08.14. 오후 9:42,0d96976146fda61bde201adf26bc00a2,https://news.naver.com/main/read.nhn?mode=LSD&mid=sec&sid1=102&oid=047&aid=0000101856,NAVER_NEWS,"""깃대종"""
5,문화일보,“국립공원 상징 동·식물 뽑아요”,"“국립공원 깃대종을 뽑아주세요.” 국립공원관리공단은 지리산과 설악산 등 전국 18개 국립공원의 ‘깃대종(생태·지리·문화적 특성을 반영하는 상징적 야생 동식물)’ 선정을 위한 설문조사를 네티즌과 지역 주민 등을 대상으로 벌이고 있다고 17일 밝혔다.깃대종은 1993년 국제연합환경계획(UNEP)이 발표한 생물 다양성 국가연구에 관한 가이드라인에서 제시됐다.우리나라에는 울산광역시의 ‘각시붕어’, 강원도 홍천의 ‘열목어’, 경기도 부천의 ‘복사꽃’ 등이 있다. 국립공원 깃대종 선정 설문 참여는 공단 홈페이지(http://knps.or.kr) 메인화면 하단 ‘깃대종 함께 찾아보세요’ 코너를 통해 할 수 있다.지리산의 경우 깃대종 예비후보로는 ▲얼룩새코미꾸리(멸종위기 야생동물 1급) ▲꼬마잠자리(〃2급) ▲구렁이(〃1급) ▲자주솜대(멸종위기야생식물 2급) ▲히어리(〃2급) ▲반달가슴곰(멸종위기종 1급) ▲만병초(지리산이 자생남방한계선으로 판단되는 중요한 종) ▲수리부엉이(멸종위기종 2급·천연기념물 324호) ▲큰소쩍새(천연기념물 324호) 등 9종이 올라와 있다.국립공원관리공단은 탐방객과 지역주민, 전문가, 네티즌 설문조사 결과를 토대로 선정위원회를 열어 이달 말 국립공원별 깃대종 동·식물 1종씩을 선정해 발표할 계획이다.산청=박영수기자 buntle@munhwa.com[Copyright ⓒ 문화일보 & munhwa.com 무단 전재 및 재배포 금지] ",,2007.08.17. 오후 12:32,68ca78c5694431f2c8f1b7711ced38d9,https://news.naver.com/main/read.nhn?mode=LSD&mid=sec&sid1=102&oid=021&aid=0000203868,NAVER_NEWS,"""깃대종"""
6,대전일보,“갑천 ‘깃대종’ 미호종개 지키자”,"“갑천이 터전인 대전의 깃대종 미호종개를 지켜주세요”김영근군(충남고 2년), 김민석군(보문고 2년), 임혜리양과 차재선양(이상 둔산여고 2·1년) 등 대전지역 고교생 4명이 충청의 토종 물고기 미호종개(천연기념물 제454호) 지킴이에 나섰다.이들은 올해 환경부의 생물자원보존 청소년 홍보대사에 임명돼 미호종개 보호활동을 펼치고 있다.미꾸리과의 미호종개는 금강 지류인 충북 청원 미호천에서 처음 발견돼 1984년 국제학계에 보고된 우리나라 고유 어종으로 최근 멸종 위기 1급 어류가 돼 천연기념물로 지정됐다.환경부도 지난 5일 인공증식 치어 3000마리를 충북 음성 초평천에 방류하는 등 2009년까지 5억여원을 들여 복원사업을 펼치고 있는 대상이다.학생들은 미호종개가 중요한 생물자원임을 알리기 위해 시민단체들과 갑천의 수질을 조사하고 생태보호 캠페인을 펼치고 있다.유인물과 책갈피, 티셔츠 등을 만들어 거리 서명운동에도 나서고 친환경 수세미도 직접 만들어 판매하고 있다.또 블로그(http://blog.naver.com/ds3npk)에 ‘미호종개가 사는 갑천길 탐사’를 주제로 한 UCC동영상 제작 등 사이버 홍보에도 뛰어들고 있다.김영근군은 “미호종개가 서식하는 갑천과 월평공원이 대전시민의 소중한 자연유산임을 알릴 계획”이라고 말했다.<박정식 기자><저작권자ⓒ대전일보사. 무단전재,재배포,본문인용 등의 행위를 금합니다.> ",,2007.10.23. 오전 11:03,f2fb600b7b266222ebd84e1a65b81346,https://news.naver.com/main/read.nhn?mode=LSD&mid=sec&sid1=102&oid=089&aid=0000120930,NAVER_NEWS,"""깃대종"""
7,뉴시스,새홀리기 '목격자를 찾습니다',"새홀리기 '목격자를 찾습니다'【서울=뉴시스】15일 오후 서울 종로구 인사동에서 '환경부 생물자원보전 청소년 홍보대사 TIM'이 새홀리기를 찾는 퍼포먼스 준비를 하고 있다.새홀리기는 한국에서 여름을 나는 철새로 매와 비슷하게 생겼지만 매보다 작고, 가슴과 배에 검은색의 세로줄무늬가 있는 것이 특징이며 남의 둥지에 알을 낳는 습성으로 그 이름을 갖게 됐다.'목격자를 찾습니다'란 대형 프랭카드를 준비하고 있는 명덕외고 1학년 윤수정, 권윤정, 신예지, 정후인 학생들이 블러그(http://blog.naver.com/tim_v)를 이용한 홍보도 활동하게 진행하고 있다. /홍찬선기자 mania@newsis.com블로그대문을 열면 보이는 저의 실종 포스터!This is the moment라는 뜻을 가진 홍보대사TIM에서저를 얼마나 간절히 찾아 헤메이는지 잘 보여주네요..새홀리기의 프로필이름 : 새홀리기(Eurasian Hobby)학명 : Falco subbuteo분류 : 황새목 매과거주지 : 탁 트인 숲, 농경지 등기타 : 환경부 지정 멸종위기동물 2급, 여름철새일단은 저를 간략하게 소개해 봤습니다.저 사진은 제가 청계천에 잠시 출현했을때 찍힌[!]사진이군요.청계천에서 발견된 제 사진을 계기로 TIM의 깃대종은 새홀리기로 확정되었죠~네, 사진에서 보듯이 저는 매와 비슷하게 생겼지만 매보다는 크기가 작고가슴과 배에 검은색의 세로 줄무늬를 가지고 있습니다.다리 부분은 약간 붉은색을 띠는데,몇몇 사람들은 저를 '붉은 반바지의 신사 새홀리기'라고 부르기도 한답니다.노란빛이 감도는 눈동자는 알수없는 오묘한 기운을 풍기기도 하죠 ^^제 꼬리는 부채처럼 촤르륵 펼쳐지며 아름다운 자태를 뽐내기도 한답니다.<저작권자ⓒ '한국언론 뉴스허브' 뉴시스통신사. 무단전재-재배포 금지.> ",,2007.11.15. 오후 8:48,26f97613b2e2aadcc6a426301d4c3136,https://news.naver.com/main/read.nhn?mode=LSD&mid=sec&sid1=102&oid=003&aid=0000647155,NAVER_NEWS,"""깃대종"""
